{
  "schema_version": "1.3",
  "summary": {
    "components": {
      "added": 0,
      "removed": 0,
      "changed": 0,
      "matched": 5
    },
    "nets": {
      "added": 0,
      "removed": 0,
      "renamed": 0,
      "membership_changed": 0,
      "matched": 3
    },
    "low_confidence": true
  },
  "low_confidence": true,
  "notes": [
    "no shared UniqueIDs between revisions; components matched by signature/refdes (heuristic, not authoritative)"
  ],
  "rename_map": {},
  "component_changes": [
    {
      "designator_a": "R1",
      "designator_b": "R1",
      "method": "signature",
      "confidence": 0.9,
      "field_changes": {}
    },
    {
      "designator_a": "R2",
      "designator_b": "R2",
      "method": "signature",
      "confidence": 0.9,
      "field_changes": {}
    },
    {
      "designator_a": "C1",
      "designator_b": "C1",
      "method": "signature",
      "confidence": 0.9,
      "field_changes": {}
    },
    {
      "designator_a": "#PWR01",
      "designator_b": "#PWR01",
      "method": "signature",
      "confidence": 0.9,
      "field_changes": {}
    },
    {
      "designator_a": "#PWR02",
      "designator_b": "#PWR02",
      "method": "signature",
      "confidence": 0.9,
      "field_changes": {}
    }
  ],
  "net_changes": [
    {
      "name_a": "+3V3",
      "name_b": "+3V3",
      "stable_id_a": "net_5e72d34f4a63",
      "stable_id_b": "net_5e72d34f4a63",
      "method": "membership",
      "jaccard": 1.0,
      "added_members": [],
      "removed_members": [],
      "name_changed": false,
      "membership_changed": false,
      "confidence": 0.6
    },
    {
      "name_a": "GND",
      "name_b": "GND",
      "stable_id_a": "net_0459555014c9",
      "stable_id_b": "net_0459555014c9",
      "method": "membership",
      "jaccard": 1.0,
      "added_members": [],
      "removed_members": [],
      "name_changed": false,
      "membership_changed": false,
      "confidence": 0.6
    },
    {
      "name_a": "MID",
      "name_b": "MID",
      "stable_id_a": "net_6ba9994ea87a",
      "stable_id_b": "net_6ba9994ea87a",
      "method": "membership",
      "jaccard": 1.0,
      "added_members": [],
      "removed_members": [],
      "name_changed": false,
      "membership_changed": false,
      "confidence": 0.6
    }
  ]
}
